{
  "schemaVersion": 1,
  "protocolVersion": 1,
  "network": "CryLoNexus Testnet",
  "chainId": 5546,
  "operatorAddress": "0x1111111111111111111111111111111111111111",
  "tier": "Operator",
  "rpcUrl": "https://rpc.crylonexus.example/rpc",
  "contracts": {
    "wrappedCryLo": "0x2222222222222222222222222222222222222222",
    "nodeStaking": "0x3333333333333333333333333333333333333333",
    "rewardManager": "0x4444444444444444444444444444444444444444"
  },
  "service": {
    "serviceName": "crylo-nexus-operator.service",
    "statusPath": "/home/example/.config/crylo-wallet/operator/status.json",
    "dataDirectory": "/home/example/.config/crylo-wallet/operator/data",
    "logDirectory": "/home/example/.config/crylo-wallet/operator/logs"
  },
  "nodeIdentity": {
    "publicId": "example-node-public-identity-0001",
    "pairingRequired": true
  },
  "generatedAt": "2026-07-01T12:00:00Z",
  "expiresAt": null
}
